{
  "$schema": "https://json-schema.org/draft/2020-12/schema",
  "$id": "finding.schema.json",
  "title": "Model Audit Finding",
  "description": "One audit finding (F number). Extends the MVP shared-issue schema; severity follows the Roadmap (Blocker / Major / Minor) and 'cannot judge' is a status, not a severity. Mapping to shared-issue: blocker = Blocker; warning = Major or Minor (judged); info is not a finding (see L1-Domain/DK-AUD-005 section 4).",
  "type": "object",
  "additionalProperties": false,
  "properties": {
    "id": {"type": "string", "pattern": "^F[0-9]+$", "description": "Finding number, stable across rounds."},
    "task": {"type": "string", "pattern": "^(A1|AUD-[VSA][0-9]{2})$", "description": "Main task the finding belongs to."},
    "tasks": {"type": "array", "items": {"type": "string", "pattern": "^(A1|AUD-[VSA][0-9]{2})$"}, "description": "Other affected tasks."},
    "title": {"type": "string", "description": "One-line statement of the problem, in plain English."},
    "status": {"type": "string", "enum": ["Pass", "Partial", "Fail", "Missing", "N/A（附条件）", "N/A 待声明", "Unclear"]},
    "severity": {"type": "string", "enum": ["Blocker", "Major", "Minor"]},
    "clause": {"type": "string", "description": "BIMGBPS clause plus LIM-nn / APL-nn where relevant."},
    "evidence": {
      "type": "array",
      "items": {
        "type": "object",
        "additionalProperties": false,
        "properties": {
          "element_id": {"type": ["string", "null"], "description": "Model element / view / sheet ID. Never shown in the AP report."},
          "value": {"type": ["string", "null"], "description": "Value with unit, three decimals for areas."},
          "note": {"type": "string", "description": "What the evidence shows. Must not contain element IDs (they are redacted in the AP report)."},
          "evidence_id": {"type": ["string", "null"], "description": "ID of an item in audit-results evidence[] (screenshot, crop, swatch, csv)."}
        },
        "required": ["note"]
      }
    },
    "label": {"type": "string", "enum": ["FACT", "INFERENCE", "GAP"]},
    "fix": {"type": "string", "description": "Direction of the fix."},
    "fix_method": {"type": "string", "enum": ["manual", "function-b", "AP", "external"]},
    "overturn_if": {"type": "string", "description": "What fact would change the conclusion."},
    "gap": {"type": ["string", "null"], "pattern": "^GAP-[0-9]{2}$", "description": "L4 capability gap, if the finding depends on one."}
  },
  "required": ["id", "task", "status", "severity", "clause", "evidence", "label"]
}
